{
    "$schema": "../schema.json",
    "issuance_date": "2024-01-06",
    "expiry_date" : "2025-01-05",
    "issuer_id": "SEBOLREG.5560678965",
    "issuer_name": "Bolagsverket",
    "issuer_country": "SE",
    "authentic_source_id" : "SEBOLREG.5560678965",
    "authentic_source_name" : "Bolagsverket",
    "credentialSubject": {
        "legal_person_id": "SEBOLREG.1234567890",
        "legal_person_name": "Test legal person"
    },
    "credentialStatus": {
        "id": "https://example.europa.eu/status/77",
        "type": "Revocation"
    },
    "credentialSchema" : {
        "id": "https://schema.bolagsverket.se/lpid/v1/schema.json",
        "type": "FullJsonSchemaValidator2021"
    }
}